{
  "$schema": "https://bazaar.melusina-os.org/schemas/melusina-app-runtime-contract-v1.schema.json",
  "app": {
    "appHash": "46d39e3f8fc1599f4016c0d2c679c082ab134d99643bb57ffa81fc2eb0644ded",
    "appId": "v4ywsgcuc6wgqvjre99k9j4js21rxt0hamxd5nsnn8q5vgw93gjh",
    "spkSha256": "566baf2a7f43f88837ec815c91a87f76f7ac4ccfb0132c76b14093722d564489",
    "version": "0.7.30"
  },
  "cleanup": {
    "steps": [
      "Delete the temporary acceptance-test grain after the visible launch probe completes."
    ]
  },
  "fixtures": [
    {
      "name": "disposable-provider-connection",
      "purpose": "Exercise one reversible sidecar-routed connection test without storing a production provider credential.",
      "setup": "Provision it only for the acceptance run; do not include credentials in this contract."
    }
  ],
  "launchProbe": {
    "expectedResult": "AiLagoon launches through its normal UI and preserves its PowerBox and grainauth boundaries.",
    "kind": "visible-ui",
    "steps": [
      {
        "action": "Install the candidate through the governed Bazaar path and launch a new AiLagoon grain through its normal app action.",
        "expectedResult": "The normal UI and Connections view render without a grainauth unknown-action denial, blank page, reset loop, or process failure. A properly configured default-Bazaar shell supplies this tenant's MELUSINA_TENANT_LICENSE_NFT only at grain exec; immutable package bytes must not contain any tenant license binding."
      },
      {
        "action": "Configure a provider connection through the normal PowerBox HTTP-out flow; do not use a direct network bypass.",
        "expectedResult": "The connection is saved through the grain UI and requests use the configured capability."
      },
      {
        "action": "From a permitted disposable peer, obtain an AiLagoon bundle through the normal PowerBox flow, make one bounded request, then revoke or drop that bundle and restart the grain.",
        "expectedResult": "The bundle works only while its consumer-bound grant is active. A failed fulfillment, revoked or dropped bundle, and an unresolved pending grant after restart are unusable rather than silently retaining capability access."
      },
      {
        "action": "Attempt a mutating action with the grain authz socket or valid license authority unavailable.",
        "expectedResult": "The grain visibly refuses the action rather than bypassing grainauth."
      }
    ]
  },
  "schema": "melusina-app-runtime-contract-v1",
  "sidecars": [
    {
      "capabilities": [
        "http-out"
      ],
      "host": "ailagoon.sidecar.host",
      "id": "ailagoon",
      "port": 443,
      "safeProbe": {
        "action": "In a fresh AiLagoon grain, use the visible Connections flow to grant HTTP-out for exactly https://ailagoon.sidecar.host, then run the connection test against a disposable provider fixture.",
        "expectedResult": "The Powerbox grant and connection test complete without a 403, TLS failure, or direct-provider bypass; the configured request is routed through the declared sidecar."
      },
      "tls": {
        "minimumVersion": "TLS1.2",
        "required": true,
        "serverName": "ailagoon.sidecar.host",
        "trust": "system-ca"
      },
      "transport": "https"
    }
  ]
}
